{
  "version": "1.2.0",
  "sourceProject": {
    "version": "1.0.0",
    "name": "customer-satisfaction-bqml",
    "scenario": "retail.customer_satisfaction",
    "generation": {
      "legacyContosoMode": true,
      "seed": 20260904,
      "orders": 1200,
      "customers": 240,
      "products": 48,
      "stores": 4,
      "startDate": "2024-01-01T00:00:00Z",
      "timeSpanDays": 365,
      "formats": [
        "CSV"
      ]
    },
    "extensions": {
      "shipments": true,
      "shipmentEvents": true,
      "returns": true,
      "supportTickets": true,
      "reviews": true
    },
    "problems": {
      "duplicates": true,
      "cdc": true,
      "lateArrivals": true,
      "scd2": true,
      "qualityIssues": true
    },
    "outputs": {
      "sql": true,
      "pyspark": true,
      "dbt": true,
      "airflow": true,
      "semanticModel": true,
      "mlSpec": true
    },
    "lab": {
      "docker": true,
      "airflow": true,
      "spark": true,
      "dbtDuckdb": true,
      "kubernetesKind": true,
      "openTofu": true
    }
  },
  "architecture": {
    "presetId": "free-gcp-connect",
    "overrides": {}
  },
  "gcp": {
    "projectId": "your-gcp-project",
    "dataset": "contoso_forge",
    "location": "US",
    "maximumBytesBilled": 1000000000
  },
  "git": {
    "repository": "https://github.com/your-account/your-repository.git",
    "branch": "main",
    "subPath": "generated/airflow/dags"
  },
  "businessScenario": "retail.customer_satisfaction_ml",
  "product": {
    "version": "1.5",
    "pipelineMode": "full-batch",
    "mlTarget": "colab-sklearn",
    "biTarget": "evidence",
    "dbtIntegration": "plain",
    "labelAsOf": "2025-02-01T00:00:00Z",
    "materializationLimitMb": 256
  }
}
